,doi,Mention title,url,outlet
114734,10.1016/j.jacr.2014.11.005,Private Radiology Groups More ‘Social’ Than Academic Groups,http://www.diagnosticimaging.com/practice-management/private-radiology-groups-more-social-academic-groups,UBM Medica
118306,10.1016/j.ypmed.2014.01.024,Using Tweets to track spread of HIV,http://www.cbsnews.com/news/study-twitter-could-be-used-to-track-spread-of-hiv/,CBS News
80896,10.1126/science.aaa0185,Social media’s next disruption: the investment industry,http://www.marketwatch.com/news/story.asp?guid=%7BD6ECB844-2E51-11E6-8A0D-4C8B75860AB1%7D&siteid=rss&rss=1,MarketWatch
125727,10.1038/s41565-019-0415-0,Water that never freezes,http://ct.moreover.com/?a=39005489570&p=1pl&v=1&x=_TdP0eJYx4HL_viCv7kG0g,Sign of the Times
122978,10.1016/j.btre.2017.05.002,Soligenix Announces Publication of Scientific Review Discussing Clinical Applications of Innate Defense Regulator Technology,http://ct.moreover.com/?a=37890590937&p=1pl&v=1&x=BT3mxh_k0cX0vHUgffXZkA,PR Newswire
47158,10.1098/rsbl.2013.0223,Military sonar can alter blue whale behavior: Human-made noises cause ocean giants to move away from feeding spots,http://www.sciencedaily.com/releases/2013/07/130703120637.htm?utm_source=feedburner&utm_medium=feed&utm_campaign=Feed%3A+sciencedaily+%28ScienceDaily%3A+Latest+Science+News%29,Science Daily
44229,10.1016/j.atmosenv.2013.05.081,More Americans die from car pollution than car accidents,http://qz.com/135509/more-americans-die-from-car-pollution-than-car-accidents/,Quartz
72691,10.1001/jamainternmed.2016.2417,The Battle of the Bulging Belly Fat – 5 steps to lose it!,http://ct.moreover.com/?a=39324441400&p=1pl&v=1&x=U0Eqffg4LMRzIa5LNjOCMg,Emaxhealth.com
19495,10.1177/1080569913501862,Men Are Way More Tolerant Of Texting In Meetings,http://www.businessinsider.com/gender-differences-in-phone-etiquette-2013-10,Business Insider
105408,10.1177/0361684318773356,You Don’t Have to Feel Beautiful to Care for Your Body,http://ct.moreover.com/?a=34427732855&p=1pl&v=1&x=mJ6dbRXnr9-jT25flY6Gcg,Psychology Today
21851,10.1016/j.icarus.2018.05.007,"Scientists introduce cosmochemical model for Pluto formation: New Horizons, Rosetta data fusion points to new theory",http://ct.moreover.com/?a=34144292956&p=1pl&v=1&x=LzMLPF3FVTVM4xORVcQdMw,Science Daily
34820,10.1038/s41598-018-25433-5,Eyes in the back of the head,http://ct.moreover.com/?a=34018770860&p=1pl&v=1&x=J4Tq-n39nRMNOAE5jYIjPA,Science Daily
65928,10.1016/j.ygyno.2015.04.025,Study: Many U.S. women too far from gynecologic cancer care,http://www.upi.com/Health_News/2015/06/11/Study-Many-US-women-too-far-from-gynecologic-cancer-care/7391434036660/,UPI.com
126086,10.1056/nejmoa1508749,House dust reveals how Amish kids avoid asthma - Futurity,http://www.futurity.org/amish-hutterite-dust-asthma-1223212-2/,Futurity
42967,10.1126/science.aax0758,Better Memory Through Electrical Brain Ripples,http://ct.moreover.com/?a=39461761057&p=1pl&v=1&x=F0ZrliyUu-q5uE8iqyTTxw,Scientific American
88049,10.1016/j.neuropharm.2015.05.036,Intellectual pursuits may curb addictions,http://www.upi.com/Health_News/2015/07/14/Intellectual-pursuits-may-curb-addictions/2451436900605/,UPI.com
71288,10.1016/j.biomaterials.2018.04.008,Scientists Used Spider Silk To Create A New Class Of Cancer Vaccine,http://ct.moreover.com/?a=34294910439&p=1pl&v=1&x=Fzh0PpfW2FsVKlSQjhW_XQ,The Inquisitr
117451,10.1016/j.biomaterials.2017.02.011,Spinach becomes beating heart tissue in the hands of these scientists,http://www.marketwatch.com/news/story.asp?guid=%7B95105316-12F0-11E7-BCC7-456FC1EDA05D%7D&siteid=rss&rss=1,MarketWatch
88902,10.1177/0956797614537280,Sports Teams May Lose Out From Having ‘Too Much Talent’,http://www.healthcanal.com/mental-health-behavior/51837-sports-teams-may-lose-out-from-having-%E2%80%98too-much-talent%E2%80%99.html,Health Canal
34251,10.1016/j.jpeds.2013.04.011,"Most youth football player concussions occur during games, not practice",http://www.sciencedaily.com/releases/2013/06/130606101722.htm?utm_source=feedburner&utm_medium=feed&utm_campaign=Feed%3A+sciencedaily+%28ScienceDaily%3A+Latest+Science+News%29,Science Daily
125484,10.1177/0192513x13519256,Short Women Still Prefer Taller Men: How Height Preferences Haven't Changed In The Search For Love,http://www.medicaldaily.com/short-women-still-prefer-taller-men-how-height-preferences-havent-changed-search-love-269037,Medical Daily
865,10.1126/science.aao0098,An artificial nerve system gives prosthetic devices and robots a sense of touch,http://ct.moreover.com/?a=34191593323&p=1pl&v=1&x=yJT1Q5VVIqV9X_u8UhglUA,Science Daily
23813,10.1038/s41467-018-04375-6,"Wars and clan structure may explain a strange biological event 7,000 years ago",http://ct.moreover.com/?a=34174196541&p=1pl&v=1&x=ranJwYkhwlSQl0l15xnmNg,Science Daily
45644,10.1038/s41586-018-0212-1,Ocean waves following sea ice loss trigger Antarctic ice shelf collapse,http://ct.moreover.com/?a=34303729417&p=1pl&v=1&x=frTIIQJN8TszlFs0oo8lDA,Science Daily
56093,10.1016/j.celrep.2018.11.010,Early-life stress changes brain development in mice,https://www.futurity.org/stress-early-life-brains-mice-1920192-2/,Futurity
90506,10.1172/jci75109,Genetic Risk Factors For Stroke Identified,http://www.science20.com/news_articles/genetic_risk_factors_for_stroke_identified-145618,Science 2.0
15618,10.1016/j.ajic.2018.09.031,Study Finds Ball Pits Can Contain a High Volume of Germs and Bacteria That Could Cause Disease,http://ct.moreover.com/?a=39084977545&p=1pl&v=1&x=PCqsvQurmRPpNC17HqMKbA,Yahoo!
91107,10.1111/jcc4.12054,Study Finds Gaming Augments Players’ Social Lives,http://www.healthcanal.com/mental-health-behavior/49150-study-finds-gaming-augments-players%E2%80%99-social-lives.html,Health Canal
50187,10.1016/j.hjdsi.2013.05.005,Study: ACO Efforts Lead to Cancer Care Savings,http://www.beckershospitalreview.com/accountable-care-organizations/study-aco-efforts-lead-to-cancer-care-savings.html,Becker's Hospital Review
124851,10.1016/j.atmosenv.2013.05.081,"Study: Air pollution causes 200,000 early deaths each year in the U.S.",http://www.nanowerk.com/news2/green/newsid=31969.php,Nanowerk
93853,10.1016/j.cub.2016.02.068,Stuttering 2016: Human Speech Disorder Finally Gets A Cure?,http://www.parentherald.com/articles/37530/20160417/stuttering-2016-human-speech-disorder-finally-cure.htm,Parent Herald
125171,10.1007/s00300-007-0300-4,Federal polar bear conservation plan focuses on near-term goals,http://www.adn.com/article/20150702/federal-polar-bear-conservation-plan-focuses-near-term-goals,Alaska Despatch News
98914,10.1542/peds.2017-2426,"Suicide-related hospital visits double among children, teens",http://ct.moreover.com/?a=34075255981&p=1pl&v=1&x=GpToUbrV2ZnhMAto_bLOdQ,Becker's Hospital Review
13576,10.1126/science.aau2728,À quoi ressemblaient les premiers kangourous ?,http://ct.moreover.com/?a=38658832303&p=1pl&v=1&x=1KvLhJ4mQhEEGgtosYdMiQ,National Geographic
36441,10.1001/jamasurg.2015.0876,Surgery Doesn't Help Women With Early-Stage Breast Carcinoma,http://www.npr.org/sections/health-shots/2015/06/03/411698622/surgery-doesnt-help-women-with-early-stage-breast-carcinoma,NPR
29376,10.1038/nphys3172,New Research Gives Explanation for Electron Splitting,http://www.techtimes.com/articles/23003/20141226/new-research-gives-explanation-for-electron-splitting.htm,Tech Times
79880,10.1145/2858036.2858550,Digital Media May Be Changing How You Think,http://www.science20.com/news_articles/digital_media_may_be_changing_how_you_think-172181,Science 2.0
116097,10.1016/j.cell.2017.09.016,Taconic Biosciences Licenses the Wild Mouse Gut Microbiome from the National Institute of Diabetes and Digestive and Kidney Diseases,http://ct.moreover.com/?a=38893169509&p=1pl&v=1&x=7ZkwffbOHOY0c5u7u4RrKQ,Benzinga
42358,10.1080/02185377.2016.1229205,The mayor of Taipei released a rap video — Quartz,http://ct.moreover.com/?a=37564230080&p=1pl&v=1&x=3Ape7nnNX3blmEDI1RcIwg,Quartz
80396,10.1001/jamainternmed.2015.2092,"Taking Statins? Don’t Worry About Memory Loss, Rutgers/University of Pennsylvania Study Finds",http://www.healthcanal.com/mental-health-behavior/64258-taking-statins-don%E2%80%99t-worry-about-memory-loss%2C-rutgers-university-of-pennsylvania-study-finds.html,Health Canal
15229,10.1098/rsbl.2011.0923,ScienceShot: A 44-Million-Year-Old Hitchhiker,http://news.sciencemag.org/plants-animals/2011/11/scienceshot-44-million-year-old-hitchhiker,Science/AAAS
76627,10.1177/0956797613518349,Talking About Social Class Improves Grades of First-Generation College Students,http://www.healthcanal.com/mental-health-behavior/47736-talking-about-social-class-improves-grades-of-first-generation-college-students.html,Health Canal
42360,10.1111/wej.12112,Glow-in-the-Dark Tampons Track Sewage Leaks in Rivers,http://www.newsweek.com/glow-dark-tampons-track-sewage-leaks-rivers-318223,Newsweek
42361,10.1111/wej.12112,Glow in the dark tampons identify sewage pollution in rivers,http://www.sciencedaily.com/releases/2015/04/150414102548.htm?utm_source=feedburner&utm_medium=feed&utm_campaign=Feed%3A+sciencedaily%2Ftop_news+%28ScienceDaily%3A+Top+News%29,Science Daily
34917,10.1111/cdev.12344,Elementary teachers' depression symptoms related to students' learning,http://www.sciencedaily.com/releases/2015/02/150211084106.htm?utm_source=feedburner&utm_medium=feed&utm_campaign=Feed%3A+sciencedaily+%28Latest+Science+News+--+ScienceDaily%29,Science Daily
130381,10.1007/s11126-005-4966-x,Can Fish Oil Pills Correct Bad Behavior In Teens?,http://www.parentherald.com/articles/39513/20160427/fish-oil-pills-correct-bad-behavior-teens.htm,Parent Herald
26249,10.3171/2017.1.jns161947,Team offers innovative approach to treat patients with complex temporal bone defects,http://healthmedicinet.com/news/team-offers-innovative-approach-to-treat-patients-with-complex-temporal-bone-defects/,Health Medicinet
14270,10.1016/j.scitotenv.2019.03.207,Banned pesticides in Europe's rivers -- ScienceDaily,http://ct.moreover.com/?a=38947838152&p=1pl&v=1&x=UGZ7cDVWxCYtWlNmauFETw,Science Daily
76376,10.1073/pnas.1424872112,'Bionic leaf' uses bacteria to convert solar energy into liquid fuel,http://www.nanowerk.com/news2/green/newsid=38975.php,Nanowerk
101391,10.1016/j.cell.2018.04.013,"Vitamin D Could Help Treat Diabetes, New Study Reveals",http://ct.moreover.com/?a=34045385045&p=1pl&v=1&x=73HBS_W5Jpt6_hJ_qEYePg,The Inquisitr
76162,10.1016/j.poetic.2012.03.003,'World Heritage' site selection is Eurocentric – and that shapes which historic places get love and money,http://ct.moreover.com/?a=39303796196&p=1pl&v=1&x=JNxoUm9BU_P_Q0YXBgKXjw,Public Radio International
78710,10.1001/jamadermatol.2014.4677,"American Teens Are Losing Interest In Indoor Tanning, Suggests Latest CDC Data",http://www.inquisitr.com/1709084/american-teens-are-losing-interest-in-indoor-tanning-suggests-latest-cdc-data/,The Inquisitr
85092,10.1007/s11248-019-00120-x,Are Regulations on Genetically Modified Organisms Holding Back Agricultural Innovation?,http://ct.moreover.com/?a=39074866688&p=1pl&v=1&x=5HPu8xC6vz738yQF823gvA,Technology Networks
18622,10.1080/02724634.2014.838175,Ancient hedgehog and tapir once inhabited British Columbia,http://www.sciencedaily.com/releases/2014/07/140708165811.htm?utm_source=feedburner&utm_medium=feed&utm_campaign=Feed%3A+sciencedaily+%28Latest+Science+News+--+ScienceDaily%29,Science Daily
88290,10.1001/jama.2019.1113,DBV Technologies’ peanut allergy patch gets FDA review,http://ct.moreover.com/?a=40362322285&p=1pl&v=1&x=kNX0lW9HulhsV2cEa-mu3A,Medcity News
91828,10.1016/j.gr.2016.08.003,"Earth's Ancient Soil is Older Than Previously Thought, Similar to Martian Land",http://www.natureworldnews.com/articles/32476/20161121/eart-ancient-soil-older-previously-thought-similar-mars.htm,Nature World News
76380,10.1073/pnas.1424872112,Researchers turn solar energy into liquid fuel,http://www.upi.com/Science_News/2015/02/12/Researchers-turn-solar-energy-into-liquid-fuel/6931423757205/,UPI.com
76619,10.1163/15685179-12341428,The Dead Sea Scrolls are a priceless link to the Bible’s past,http://ct.moreover.com/?a=37545338759&p=1pl&v=1&x=VGaWL6SyegNLHXRkc0HXZw,Public Radio International
34250,10.1016/j.jpeds.2013.04.011,NFL doctor: Youth football is safer than riding a bike,http://www.vox.com/2015/3/18/8242787/nfl-concussions-cte-doctor,Vox.com
18709,10.1126/science.aaa0185,Expert panels successfully rate medical research proposals,http://www.sciencedaily.com/releases/2015/04/150423142820.htm?utm_source=feedburner&utm_medium=feed&utm_campaign=Feed%3A+sciencedaily%2Ftop_news+%28ScienceDaily%3A+Top+News%29,Science Daily
59000,10.1098/rspb.2017.2456,The Shark Poop Diet,http://ct.moreover.com/?a=33739457262&p=1pl&v=1&x=Jc7KK9KXNzzhfO82mc20ZQ,Inside Science
101861,10.1038/337611a0,Shroud of Turin Image An Atomic Photo Caused By Massive Quake — What?,http://www.inquisitr.com/1131843/shroud-of-turin-image-an-atomic-photo-caused-by-massive-quake-what/,The Inquisitr
2407,10.1073/pnas.1402905111,Taung Child's brain development not human-like? CT scan casts doubt on similarity to that of modern humans,http://www.sciencedaily.com/releases/2014/08/140825152556.htm?utm_source=feedburner&utm_medium=feed&utm_campaign=Feed%3A+sciencedaily+%28Latest+Science+News+--+ScienceDaily%29,Science Daily
27502,10.1021/es504801x,Heat boosts phthalate emissions from vinyl crib mattress covers,http://www.sciencedaily.com/releases/2014/12/141217101336.htm?utm_source=feedburner&utm_medium=feed&utm_campaign=Feed%3A+sciencedaily%2Ftop_news+%28ScienceDaily%3A+Top+News%29,Science Daily
60207,10.1056/nejmoa1503093,FDA Expands Pembrolizumab Label for Melanoma,http://www.cancernetwork.com/melanoma/fda-expands-pembrolizumab-label-melanoma,UBM Medica
1791,10.1085/jgp.201611585,Why KID Syndrome patients experience different sets of symptoms,http://healthmedicinet.com/news/why-kid-syndrome-patients-experience-different-sets-of-symptoms/,Health Medicinet
56678,10.1073/pnas.1404469111,Memory Test Demonstrates How Rewards Can Improve Recall Of Unstudied Information,http://www.medicaldaily.com/memory-test-demonstrates-how-rewards-can-improve-recall-unstudied-information-311076,Medical Daily
118646,10.1038/ng.3285,Researchers Finally Answer The Age-Old Nature Vs. Nurture Question,http://www.inquisitr.com/2105966/researchers-finally-answer-the-age-old-nature-vs-nurture-question/,The Inquisitr
85093,10.1007/s11248-019-00120-x,"The E.U. is strict on G.M. crops, but is it logical?",https://www.futurity.org/genetically-modified-crops-eu-2053912-2/,Futurity
47602,10.1080/10937404.2013.842523,Open Access Article on Biological Effects of the Popular Artificial Sweetener Sucralose,http://www.sciencedaily.com/releases/2013/12/131212095900.htm?utm_source=feedburner&utm_medium=feed&utm_campaign=Feed%3A+sciencedaily+%28ScienceDaily%3A+Latest+Science+News%29,Science Daily
52368,10.1111/j.1460-2466.2004.tb02632.x,Which 2020 Candidates Are Running The Most TV Ads?,http://ct.moreover.com/?a=40286194117&p=1pl&v=1&x=S8ZiWYVlcwSpfHBV28SmlA,FiveThirtyEight
88146,10.1057/s41599-018-0201-x,"Link between poverty, obesity developed in last 30 years",http://ct.moreover.com/?a=37952719550&p=1pl&v=1&x=LArjpdt39Jiu67sTnV0gCg,UPI.com
80081,10.2105/ajph.2013.301379,"Study: Self-monitoring diets not time-consuming, work best",http://ct.moreover.com/?a=38637559482&p=1pl&v=1&x=fPkPFEEZemDlChWr2hjGWw,UPI.com
45288,10.1093/brain/awv092,Researchers show how blood-brain barrier is maintained,http://www.sciencedaily.com/releases/2015/04/150422121720.htm?utm_source=feedburner&utm_medium=feed&utm_campaign=Feed%3A+sciencedaily%2Ftop_news+%28ScienceDaily%3A+Top+News%29,Science Daily
43,10.1126/sciadv.aaq1012,The weird power of rising carbon dioxide to make rice less nutritious,http://ct.moreover.com/?a=34131427536&p=1pl&v=1&x=Kwth0Yf-SAMASybHC0TfYg,Vox.com
86516,10.1113/jp276943,"Exercise Can Help You Counter Effects of Shift Work, Jet Lag, Other Disruptions to Circadian Clock | Physiology",http://feedproxy.google.com/~r/BreakingScienceNews/~3/IxZsTC24_kU/exercise-circadian-clock-06926.html,Sci-News
91365,10.1016/j.jadohealth.2015.05.006,Hospitalizations For Mental Illness Far Higher In Kids Who Have Been To Juvenile Detention,http://www.medicaldaily.com/hospitalizations-mental-illness-far-higher-kids-who-have-been-juvenile-detention-344282,Medical Daily
108640,10.1111/cdev.12344,Teachers’ Depression Linked to Poor Student Performance,http://psychcentral.com/news/2015/02/12/teachers-depression-linked-to-poor-student-performance/81153.html,Psych Central
4220,10.1080/13555502.2014.947188,Africa's ancient traditions are getting digitized for future use — Quartz Africa,http://ct.moreover.com/?a=37157861990&p=1pl&v=1&x=wIk0gb12LwrEgsf9d4Prow,Quartz
96846,10.1177/1060028014549185,Use with Caution: High Doses of Vancomycin Fuel Risk of Kidney Damage in Children,http://www.healthcanal.com/kidneys-urinary-system/58677-use-with-caution-high-doses-of-vancomycin-fuel-risk-of-kidney-damage-in-children.html,Health Canal
117132,10.1038/s41586-018-0106-2,Scientists discover the source of new CFC emissions,http://news.mit.edu/2019/scientists-discover-new-cfc-emissions-source-0523,MIT News
22172,10.1007/s00340-014-5796-z,Compact proton therapy for fight against cancer,http://www.sciencedaily.com/releases/2014/06/140610103740.htm?utm_source=feedburner&utm_medium=feed&utm_campaign=Feed%3A+sciencedaily+%28Latest+Science+News+--+ScienceDaily%29,Science Daily
300,10.1126/science.1237973,Researcher sheds light on M.O. of unusual RNA molecules,http://www.sciencedaily.com/releases/2013/07/130705212230.htm?utm_source=feedburner&utm_medium=feed&utm_campaign=Feed%3A+sciencedaily+%28ScienceDaily%3A+Latest+Science+News%29,Science Daily
24447,10.1038/s41586-018-0127-x,How human brains became so big,http://ct.moreover.com/?a=34142857729&p=1pl&v=1&x=Ix6k7MT2fQ_GDS461Gz5EQ,Yahoo!
51945,10.1016/j.cub.2015.06.043,Here’s why human screams make your skin crawl,http://www.pbs.org/newshour/rundown/brains-love-hate-screams/,PBS
86120,10.1016/j.icarus.2018.05.007,Is Pluto made of a billion comets? | EarthSky.org,http://earthsky.org/space/swri-giant-comet-model-of-pluto-formation,EarthSky
82588,10.1096/fj.13-239384,Dark chocolate is good for you thanks to gut bacteria,http://www.nydailynews.com/life-style/health/dark-chocolate-good-thanks-gut-bacteria-article-1.1727196,New York Daily News
53987,10.1016/s2468-2667(18)30135-x,5 Long-Term Health Risks of Going Keto,http://ct.moreover.com/?a=38858132734&p=1pl&v=1&x=wYks9hk3XbFfYmGiL3ry3w,Health
55419,10.15184/aqy.2018.166,Hidden Monuments and Cookie-Cutter 'Suburbs' Discovered in Ancient Izapa Kingdom,http://ct.moreover.com/?a=37530986156&p=1pl&v=1&x=nJItosWJypMBkKYlh4oaCQ,LiveScience
127185,10.1038/s41598-019-39917-5,Drones help scientists count koalas in Australia,http://ct.moreover.com/?a=38669960019&p=1pl&v=1&x=57UXYRievp94XIS-nvyE9A,UPI.com
48860,10.1136/bmjopen-2014-005561,Only 10% of obese people know they are overweight — here's how to tell if you are,http://ct.moreover.com/?a=33884040617&p=1pl&v=1&x=lPnx01QIGeNcDRtXN2nyDw,Business Insider
7227,10.1126/science.aao1082,Nature’s Mechanical Secrets Could Help Build Faster Robots,http://ct.moreover.com/?a=33896691549&p=1pl&v=1&x=jHu2Urba4WuYB1qg8RRGSQ,Wired.com
79404,10.1038/s41598-019-39502-w,"New imaging system detects tiny tumors, may aid earlier diagnosis",http://ct.moreover.com/?a=38710933020&p=1pl&v=1&x=Fi0wBIxSc8avfYIbOjiUQg,UPI.com
54372,10.1200/jco.2010.29.4041,Angelina Jolie and Other Celebrities With Breast Cancer: 11 Stars Who Have Undergone A Mastectomy,http://www.medicaldaily.com/articles/15517/20130514/angelina-jolie-celebrities-breast-cancer-11-stars.htm,Medical Daily
52504,10.1071/rd17539,Female wombats indicate fertility by biting males,http://ct.moreover.com/?a=34017247874&p=1pl&v=1&x=L6E6CYKoj0B7cM3FLqOZJQ,UPI.com
98906,10.1542/peds.2017-2426,Hospitals See Growing Numbers Of Kids And Teens At Risk For Suicide,http://ct.moreover.com/?a=34060915445&p=1pl&v=1&x=drdxQ8H17nQ7LA8EQXdIbA,KPBS
98909,10.1542/peds.2017-2426,Study Shows Increase In Youth Suicide Attempts,http://ct.moreover.com/?a=34061448799&p=1pl&v=1&x=UvXTSeQFcimdybg1SQOSzA,Newswise
130038,10.1098/rsbl.2013.0223,Military Sonar May Hurt Blue Whales,http://www.livescience.com/37969-military-sonar-may-hurt-blue-whales.html,LiveScience
51272,10.1016/j.jaa.2015.09.003,Bones hint at lives of Maya middle class - Futurity,http://www.futurity.org/bones-maya-ancient-history-1037642/,Futurity
76598,10.1126/science.aal4369,Study maps out dramatic costs of unmitigated climate change in the U.S.,http://feedproxy.google.com/~r/TechnologyOrg/~3/uailsgCz-8c/,Technology.org
34032,10.1126/science.aau1549,CRISPR Gene Editing Fixes Muscular Dystrophy in Dogs. Are Humans Next?,http://ct.moreover.com/?a=34966694872&p=1pl&v=1&x=3xMquRSqCFjAT0js6p0Ptg,Yahoo!
118500,10.1093/qjmed/hct077,"Live fast, die young: Celebs and athletes have shorter life spans",http://www.nydailynews.com/life-style/health/live-fast-die-young-celebs-athletes-shorter-life-spans-article-1.1320753,New York Daily News
65788,10.1016/j.displa.2019.03.001,Visual rendering of shapes on 2-D display devices guided by hand gestures,http://ct.moreover.com/?a=37631303250&p=1pl&v=1&x=sJCNl_MZIh66QzMcwMjtrQ,Tech Xplore
84052,10.1073/pnas.1410494111,‘Squid skin’ metamaterials project yields vivid color display,http://www.technology.org/2014/09/16/squid-skin-metamaterials-project-yields-vivid-color-display/,Technology.org
45161,10.1016/j.ccr.2014.02.009,Adult cancer drugs show promise against an aggressive childhood brain tumor,http://www.sciencedaily.com/releases/2014/03/140327135742.htm?utm_source=feedburner&utm_medium=feed&utm_campaign=Feed%3A+sciencedaily+%28Latest+Science+News+--+ScienceDaily%29,Science Daily
118644,10.1038/ng.3285,Nature or nurture? Twins suggest it’s a tie,http://www.futurity.org/twins-nature-nurture-926872/,Futurity
120308,10.1093/beheco/arr214,Recent Beard Boom May Be Making It Less Appealing To Women,http://www.hngn.com/articles/29065/20140417/recent-beard-boom-making-less-appealing-women.htm,Headlines & Global News
125790,10.1016/j.molcel.2013.08.010,Why Redheads Are at Higher Risk for Melanoma,http://www.livescience.com/39094-redhead-health-risks.html,LiveScience
111823,10.1016/j.cub.2013.07.058,Fish Schooling Ability Determined by Genetic Factors,http://www.natureworldnews.com/articles/3980/20130914/fish-schooling-ability-determined-genetic-factors.htm,Nature World News
34029,10.1126/science.aau1549,"Gene Editing Treats Muscular Dystrophy in Dogs
     |
    Smart News",http://ct.moreover.com/?a=34970207798&p=1pl&v=1&x=TUIBChTFlDD1Cauos2c4HA,Smithsonian Magazine
84177,10.1111/gcb.12390,Can corals adapt to climate change?,http://earthsky.org/earth/can-corals-adapt-to-climate-change,EarthSky
4356,10.1111/jcc4.12109,No Joke! iFans Really Suffer from Separation Anxiety When Away from iPhones,http://www.techtimes.com/articles/25831/20150112/joke-ifans-really-suffer-separation-anxiety-when-away-iphones.htm,Tech Times
18772,10.1111/risa.13170,Do rock climbers seek out high-risk climbs? -- ScienceDaily,http://ct.moreover.com/?a=37131432931&p=1pl&v=1&x=FYKcokMjam7JfyfyGi94tA,Science Daily
15663,10.1109/joe.2017.2733798,Robot Stingrays Sunk Your Battleship,http://ct.moreover.com/?a=33960753245&p=1pl&v=1&x=RvEHrOgzBV6v0C5Fqvmfdg,Popular Mechanics
97658,10.1126/science.aan4153,Immune cell provides cradle for mammary stem cells,http://feedproxy.google.com/~r/TechnologyOrg/~3/sMp--3jzEQE/,Technology.org
103703,10.1183/13993003.01592-2017,Research suggests vapers may be vulnerable to lung infections,http://feedproxy.google.com/~r/TechnologyOrg/~3/J958FZ8-k80/,Technology.org
117099,10.1126/science.aab2319,'Paleo' diet works if you have Inuit genes - Futurity,http://www.futurity.org/inuit-diet-genes-1007932/,Futurity
87276,10.1136/bmj.f5239,Economic Crisis: Higher Suicide Rates in Men may be Linked to Financial Hardship,http://www.scienceworldreport.com/articles/9552/20130918/economic-crisis-higher-suicide-rates-men-linked-financial-hardship.htm,Science World Report
40181,10.1038/s41593-018-0213-2,Secret immune cell tunnels found in human skulls,http://ct.moreover.com/?a=34930618619&p=1pl&v=1&x=58vxJ1EopN9x_dAgK4aKVw,Yahoo!
24004,10.1016/j.joule.2019.05.012,Bitcoin causing carbon dioxide emissions comparable to Las Vegas or Hamburg,http://ct.moreover.com/?a=39453464903&p=1pl&v=1&x=c85BtjOC3xeDbZzKrumASA,Science Daily
56226,10.1126/sciadv.aar2904,Newly developed patch measures cortisol in sweat,http://ct.moreover.com/?a=34612672663&p=1pl&v=1&x=lIPH3infRfJ-_N9kHjXjwg,UPI.com
32181,10.1038/nn.3794,Haven't my neurons seen this before? What happens in the brain with familiar pictures?,http://www.sciencedaily.com/releases/2014/08/140824152347.htm?utm_source=feedburner&utm_medium=feed&utm_campaign=Feed%3A+sciencedaily%2Ftop_news%2Ftop_science+%28ScienceDaily%3A+Top+Science+News%29,Science Daily
19496,10.1177/1080569913501862,Reading this in a meeting? Women twice as likely as men to be offended by smartphone use,http://www.sciencedaily.com/releases/2013/10/131024182551.htm?utm_source=feedburner&utm_medium=feed&utm_campaign=Feed%3A+sciencedaily+%28ScienceDaily%3A+Latest+Science+News%29,Science Daily
125274,10.1109/access.2013.2260813,NYU WIRELESS Founder Theodore S. Rappaport Elected as National Academy of Inventors Fellow,http://ct.moreover.com/?a=37961914732&p=1pl&v=1&x=Fz2Pm4eghSLmsQlB8Op3OA,PR Newswire
15616,10.1016/j.ajic.2018.09.031,Therapeutic Ball Pits Found to Harbor Pathogenic Germs,http://ct.moreover.com/?a=38875271221&p=1pl&v=1&x=Rea_bMurwKU24Z-HbD7lKQ,Physician's Briefing
12200,10.1038/s41591-018-0049-z,Genome-editing tool could increase cancer risk,http://ct.moreover.com/?a=34278185339&p=1pl&v=1&x=XhcXtcU0n3VfZdxTmOlYKQ,Science Daily
